{
  "$schema": "https://json-schema.org/draft/2020-12/schema",
  "type": "object",
  "properties": {
    "schemaVersion": {
      "type": "number",
      "const": 1
    },
    "gm2godotVersion": {
      "type": "string",
      "minLength": 1
    },
    "inventory": {
      "type": "object",
      "properties": {
        "project": {
          "type": "object",
          "properties": {
            "name": {
              "type": "string"
            },
            "yypPath": {
              "anyOf": [
                {
                  "type": "string"
                },
                {
                  "type": "null"
                }
              ]
            },
            "ideVersion": {
              "type": "string"
            },
            "resourceType": {
              "type": "string"
            },
            "resourceVersion": {
              "type": "string"
            }
          },
          "required": [
            "name",
            "yypPath",
            "ideVersion",
            "resourceType",
            "resourceVersion"
          ],
          "additionalProperties": false
        },
        "resources": {
          "type": "array",
          "items": {
            "type": "object",
            "properties": {
              "name": {
                "type": "string"
              },
              "kind": {
                "type": "string"
              },
              "typeName": {
                "type": "string"
              },
              "yypPath": {
                "type": "string"
              },
              "sourcePaths": {
                "type": "array",
                "items": {
                  "type": "string"
                }
              },
              "godotPath": {
                "anyOf": [
                  {
                    "type": "string"
                  },
                  {
                    "type": "null"
                  }
                ]
              }
            },
            "required": [
              "name",
              "kind",
              "typeName",
              "yypPath",
              "sourcePaths",
              "godotPath"
            ],
            "additionalProperties": false
          }
        },
        "objects": {
          "type": "array",
          "items": {
            "type": "object",
            "properties": {
              "name": {
                "type": "string"
              },
              "parentObjectName": {
                "anyOf": [
                  {
                    "type": "string"
                  },
                  {
                    "type": "null"
                  }
                ]
              },
              "persistent": {
                "type": "boolean"
              },
              "solid": {
                "type": "boolean"
              },
              "spriteName": {
                "anyOf": [
                  {
                    "type": "string"
                  },
                  {
                    "type": "null"
                  }
                ]
              },
              "events": {
                "type": "array",
                "items": {
                  "type": "object",
                  "properties": {
                    "eventType": {
                      "type": "integer",
                      "minimum": -9007199254740991,
                      "maximum": 9007199254740991
                    },
                    "eventNum": {
                      "type": "integer",
                      "minimum": -9007199254740991,
                      "maximum": 9007199254740991
                    },
                    "file": {
                      "anyOf": [
                        {
                          "type": "string"
                        },
                        {
                          "type": "null"
                        }
                      ]
                    }
                  },
                  "required": [
                    "eventType",
                    "eventNum",
                    "file"
                  ],
                  "additionalProperties": false
                }
              }
            },
            "required": [
              "name",
              "parentObjectName",
              "persistent",
              "solid",
              "spriteName",
              "events"
            ],
            "additionalProperties": false
          }
        },
        "rooms": {
          "type": "array",
          "items": {
            "type": "object",
            "properties": {
              "name": {
                "type": "string"
              },
              "width": {
                "type": "integer",
                "minimum": -9007199254740991,
                "maximum": 9007199254740991
              },
              "height": {
                "type": "integer",
                "minimum": -9007199254740991,
                "maximum": 9007199254740991
              },
              "persistent": {
                "type": "boolean"
              },
              "parentRoomName": {
                "anyOf": [
                  {
                    "type": "string"
                  },
                  {
                    "type": "null"
                  }
                ]
              },
              "creationCodeFile": {
                "anyOf": [
                  {
                    "type": "string"
                  },
                  {
                    "type": "null"
                  }
                ]
              },
              "ordered": {
                "type": "boolean"
              },
              "layers": {
                "type": "array",
                "items": {
                  "type": "object",
                  "properties": {
                    "name": {
                      "type": "string"
                    },
                    "resourceType": {
                      "type": "string"
                    },
                    "depth": {
                      "anyOf": [
                        {
                          "type": "number"
                        },
                        {
                          "type": "null"
                        }
                      ]
                    },
                    "order": {
                      "anyOf": [
                        {
                          "type": "integer",
                          "minimum": -9007199254740991,
                          "maximum": 9007199254740991
                        },
                        {
                          "type": "null"
                        }
                      ]
                    }
                  },
                  "required": [
                    "name",
                    "resourceType",
                    "depth",
                    "order"
                  ],
                  "additionalProperties": false
                }
              },
              "instances": {
                "type": "array",
                "items": {
                  "type": "object",
                  "properties": {
                    "name": {
                      "anyOf": [
                        {
                          "type": "string"
                        },
                        {
                          "type": "null"
                        }
                      ]
                    },
                    "objectName": {
                      "anyOf": [
                        {
                          "type": "string"
                        },
                        {
                          "type": "null"
                        }
                      ]
                    },
                    "x": {
                      "anyOf": [
                        {
                          "type": "number"
                        },
                        {
                          "type": "null"
                        }
                      ]
                    },
                    "y": {
                      "anyOf": [
                        {
                          "type": "number"
                        },
                        {
                          "type": "null"
                        }
                      ]
                    }
                  },
                  "required": [
                    "name",
                    "objectName",
                    "x",
                    "y"
                  ],
                  "additionalProperties": false
                }
              }
            },
            "required": [
              "name",
              "width",
              "height",
              "persistent",
              "parentRoomName",
              "creationCodeFile",
              "ordered",
              "layers",
              "instances"
            ],
            "additionalProperties": false
          }
        },
        "scripts": {
          "type": "array",
          "items": {
            "type": "object",
            "properties": {
              "name": {
                "type": "string"
              },
              "gmlPath": {
                "anyOf": [
                  {
                    "type": "string"
                  },
                  {
                    "type": "null"
                  }
                ]
              }
            },
            "required": [
              "name",
              "gmlPath"
            ],
            "additionalProperties": false
          }
        },
        "sprites": {
          "type": "array",
          "items": {
            "type": "object",
            "properties": {
              "name": {
                "type": "string"
              },
              "width": {
                "type": "integer",
                "minimum": -9007199254740991,
                "maximum": 9007199254740991
              },
              "height": {
                "type": "integer",
                "minimum": -9007199254740991,
                "maximum": 9007199254740991
              },
              "frameCount": {
                "type": "integer",
                "minimum": -9007199254740991,
                "maximum": 9007199254740991
              }
            },
            "required": [
              "name",
              "width",
              "height",
              "frameCount"
            ],
            "additionalProperties": false
          }
        },
        "shaders": {
          "type": "array",
          "items": {
            "type": "object",
            "properties": {
              "name": {
                "type": "string"
              },
              "vertexPath": {
                "anyOf": [
                  {
                    "type": "string"
                  },
                  {
                    "type": "null"
                  }
                ]
              },
              "fragmentPath": {
                "anyOf": [
                  {
                    "type": "string"
                  },
                  {
                    "type": "null"
                  }
                ]
              }
            },
            "required": [
              "name",
              "vertexPath",
              "fragmentPath"
            ],
            "additionalProperties": false
          }
        },
        "extensions": {
          "type": "array",
          "items": {
            "type": "object",
            "properties": {
              "name": {
                "type": "string"
              },
              "functions": {
                "type": "array",
                "items": {
                  "type": "object",
                  "properties": {
                    "name": {
                      "type": "string"
                    },
                    "externalName": {
                      "anyOf": [
                        {
                          "type": "string"
                        },
                        {
                          "type": "null"
                        }
                      ]
                    },
                    "argCount": {
                      "anyOf": [
                        {
                          "type": "integer",
                          "minimum": -9007199254740991,
                          "maximum": 9007199254740991
                        },
                        {
                          "type": "null"
                        }
                      ]
                    },
                    "fileName": {
                      "type": "string"
                    }
                  },
                  "required": [
                    "name",
                    "externalName",
                    "argCount",
                    "fileName"
                  ],
                  "additionalProperties": false
                }
              }
            },
            "required": [
              "name",
              "functions"
            ],
            "additionalProperties": false
          }
        },
        "diagnostics": {
          "type": "array",
          "items": {}
        }
      },
      "required": [
        "project",
        "resources",
        "objects",
        "rooms",
        "scripts",
        "sprites",
        "shaders",
        "extensions",
        "diagnostics"
      ],
      "additionalProperties": false
    },
    "gmlApiEntries": {
      "type": "array",
      "items": {
        "type": "object",
        "properties": {
          "name": {
            "type": "string"
          },
          "category": {
            "type": "string"
          },
          "status": {
            "type": "string"
          },
          "issueNumber": {
            "type": "integer",
            "minimum": -9007199254740991,
            "maximum": 9007199254740991
          },
          "ownerModule": {
            "type": "string"
          },
          "parserSupport": {
            "type": "string"
          },
          "emitterSupport": {
            "type": "string"
          },
          "runtimeSupport": {
            "type": "string"
          },
          "smokeCoverage": {
            "type": "string"
          },
          "docsUrl": {
            "type": "string"
          },
          "notes": {
            "type": "string"
          }
        },
        "required": [
          "name",
          "category",
          "status",
          "issueNumber",
          "ownerModule",
          "parserSupport",
          "emitterSupport",
          "runtimeSupport",
          "smokeCoverage",
          "docsUrl",
          "notes"
        ],
        "additionalProperties": false
      }
    }
  },
  "required": [
    "schemaVersion",
    "gm2godotVersion",
    "inventory",
    "gmlApiEntries"
  ],
  "additionalProperties": false
}
